{
  "schema_version": 1,
  "generator": "scripts/generate-v8-evidence-index.mjs",
  "generator_version": 1,
  "candidate": {
    "release_dir": ".release-evidence/customer-release-v8-local-20260913-r2",
    "digest_source": ".release-evidence/customer-release-v8-local-20260913-r2/release-inventory.json",
    "digest_source_exists": true
  },
  "commit_sha": "82f287219cab3230a02a2b9d7a9a8b9ba93e9d16",
  "candidate_digest": "0d78abdece256237805792ca6b5339fba53e7018001eaa4a81ba73ae262539f4",
  "environment": {
    "platform": "win32",
    "arch": "x64",
    "os_type": "Windows_NT",
    "os_release": "10.0.19045",
    "hostname": "DESKTOP-8SVSB4R",
    "gate_host_provenance": "unknown"
  },
  "tool_versions": {
    "node": "v24.12.0",
    "pnpm": "10.29.3",
    "python": "Python 3.13.12",
    "docker": "Docker version 29.0.2-rd, build 5a2d7eb",
    "os": "Windows_NT 10.0.19045 (x64)"
  },
  "evidence_levels": {
    "vocabulary": [
      "source_inspection",
      "unit_contract",
      "packaged_consumer",
      "isolated_integration",
      "native_host",
      "deployed_environment",
      "customer_observed",
      "externally_approved"
    ],
    "floor": "source_inspection",
    "semantics": "Ordered weakest to strongest. evidence_level is the highest level the gate's artefacts substantiate and can never exceed evidence_level_ceiling, which is the most the gate's own command can ever support; a lower level must never stand in for a higher one. Gates with no captured log substantiate nothing and report the vocabulary floor. A level only counts as substantiated evidence when the record's status is PASS; FAIL, NOT_RUN and unknown records keep the level for context but must never be aggregated as evidence at that level."
  },
  "status_vocabulary": [
    "PASS",
    "FAIL",
    "NOT_RUN",
    "unknown"
  ],
  "status_semantics": {
    "PASS": "The gate's own exit status is 0.",
    "FAIL": "The gate failed with a non-zero exit status.",
    "NOT_RUN": "No log and no result file exist; the gate was not run for this candidate.",
    "unknown": "A log exists but the exit status could not be derived; never read as success."
  },
  "determinism": "This index contains no generation timestamp: per-gate timing comes only from captured start markers and log modification times, so repeated runs over unchanged artefacts are byte-identical.",
  "methodology": "Every field is derived from artefacts on disk: exit status from a gate result file or a decisive terminal log marker, timing from a captured start marker plus the log mtime, digests from SHA-256 of the log and of a declared artifact, test counts from the log when the format is known. Any value that could not be derived is the explicit string 'unknown' and any gate without a log is reported as NOT_RUN; no gate is ever omitted and no measurement, host, timestamp or customer fact is invented.",
  "status_counts": {
    "PASS": 23,
    "FAIL": 5,
    "NOT_RUN": 0,
    "unknown": 2
  },
  "gate_count": 30,
  "gates": [
    {
      "gate_id": "01-git-diff-check",
      "task_ids": [
        "T34",
        "T35"
      ],
      "feature_ids": [
        "EVAL-01",
        "EVAL-02"
      ],
      "status": "PASS",
      "command": "git diff --check",
      "exit_code": 0,
      "started_at_utc": "2026-09-13T19:06:30.286Z",
      "ended_at_utc": "2026-09-13T19:06:31.629Z",
      "duration_ms": 1343,
      "commit_sha": "82f287219cab3230a02a2b9d7a9a8b9ba93e9d16",
      "candidate_digest": "0d78abdece256237805792ca6b5339fba53e7018001eaa4a81ba73ae262539f4",
      "environment": {
        "platform": "win32",
        "arch": "x64",
        "os_type": "Windows_NT",
        "os_release": "10.0.19045",
        "hostname": "DESKTOP-8SVSB4R",
        "gate_host_provenance": "unknown"
      },
      "tool_versions": {
        "node": "v24.12.0",
        "pnpm": "10.29.3",
        "python": "Python 3.13.12",
        "docker": "Docker version 29.0.2-rd, build 5a2d7eb",
        "os": "Windows_NT 10.0.19045 (x64)"
      },
      "test_counts": "unknown",
      "observed_effect": "Machine-readable result file recorded exit_code=0 for: git diff --check Last non-empty log line: [aidr-gate] ended_at_utc=2026-09-13T19:06:31.629Z exit_code=0",
      "log_sha256": "5164f2bdde497f0d400725146da63fa47f01937a65f7b33fcb58c80cac2c7237",
      "artifact_sha256": "unknown",
      "limitations": [
        "Worktree-hygiene gate: it proves absence of whitespace errors and conflict markers in the working tree, not product behaviour.",
        "exit_code and timing were read from the machine-readable result file .release-evidence/v8-logs/01-git-diff-check.log.result.json written when the gate was run.",
        "The log does not embed a commit SHA or candidate digest, so its correspondence to commit 82f287219cab3230a02a2b9d7a9a8b9ba93e9d16 and candidate digest 0d78abdece256237805792ca6b5339fba53e7018001eaa4a81ba73ae262539f4 is not proven.",
        "environment and tool_versions describe the host that generated this index, not necessarily the host that produced this log; see environment.gate_host_provenance.",
        "task_ids and feature_ids are gate-level bindings declared in scripts/generate-v8-evidence-index.mjs from the verification steps and related-feature lines of docs/production-readiness/next-agent-execution-prompt-v8.md; they are not per-artifact proof.",
        "owner is a declared accountability role for the gate, not a named individual attestation."
      ],
      "owner": "release-engineering",
      "evidence_level": "source_inspection",
      "evidence_level_ceiling": "source_inspection"
    },
    {
      "gate_id": "02-feature-inventory",
      "task_ids": [
        "T34",
        "T35"
      ],
      "feature_ids": [
        "EVAL-01",
        "EVAL-02",
        "EVAL-03",
        "DEP-05"
      ],
      "status": "PASS",
      "command": "node scripts/generate-feature-inventory.mjs",
      "exit_code": 0,
      "started_at_utc": "unknown",
      "ended_at_utc": "unknown",
      "duration_ms": "unknown",
      "commit_sha": "82f287219cab3230a02a2b9d7a9a8b9ba93e9d16",
      "candidate_digest": "0d78abdece256237805792ca6b5339fba53e7018001eaa4a81ba73ae262539f4",
      "environment": {
        "platform": "win32",
        "arch": "x64",
        "os_type": "Windows_NT",
        "os_release": "10.0.19045",
        "hostname": "DESKTOP-8SVSB4R",
        "gate_host_provenance": "unknown"
      },
      "tool_versions": {
        "node": "v24.12.0",
        "pnpm": "10.29.3",
        "python": "Python 3.13.12",
        "docker": "Docker version 29.0.2-rd, build 5a2d7eb",
        "os": "Windows_NT 10.0.19045 (x64)"
      },
      "test_counts": "unknown",
      "observed_effect": "Terminal log marker for exit_code=0: Validated 71 capability records: {\"wired\":41,\"partial\":27,\"missing\":1,\"external\":2} Last non-empty log line: Validated 71 capability records: {\"wired\":41,\"partial\":27,\"missing\":1,\"external\":2}",
      "log_sha256": "bc3ff9b6ebe17e2c6cf055e7e0ff88a9da49462ee483258b97f67d87ccac200e",
      "artifact_sha256": "1cd87951d3a340776ea866e053ccbe03a716c41393e4686da68219bab44c704d",
      "limitations": [
        "The generator's completion line proves the inventory was regenerated from declared sources; it is not production acceptance of any capability.",
        "Capability statuses remain wired/partial/missing/external and the recorded decision stays NO-GO.",
        "exit_code and status were derived from the gate's own decisive terminal log marker; no captured exit-status result file exists for this run.",
        "The log does not embed a commit SHA or candidate digest, so its correspondence to commit 82f287219cab3230a02a2b9d7a9a8b9ba93e9d16 and candidate digest 0d78abdece256237805792ca6b5339fba53e7018001eaa4a81ba73ae262539f4 is not proven.",
        "environment and tool_versions describe the host that generated this index, not necessarily the host that produced this log; see environment.gate_host_provenance.",
        "task_ids and feature_ids are gate-level bindings declared in scripts/generate-v8-evidence-index.mjs from the verification steps and related-feature lines of docs/production-readiness/next-agent-execution-prompt-v8.md; they are not per-artifact proof.",
        "owner is a declared accountability role for the gate, not a named individual attestation."
      ],
      "owner": "release-engineering",
      "evidence_level": "source_inspection",
      "evidence_level_ceiling": "source_inspection"
    },
    {
      "gate_id": "03-sales-gap-audit",
      "task_ids": [
        "T34",
        "T41"
      ],
      "feature_ids": [
        "EVAL-02",
        "EVAL-03",
        "BIL-01"
      ],
      "status": "PASS",
      "command": "node scripts/generate-production-sales-gap-audit.mjs",
      "exit_code": 0,
      "started_at_utc": "unknown",
      "ended_at_utc": "unknown",
      "duration_ms": "unknown",
      "commit_sha": "82f287219cab3230a02a2b9d7a9a8b9ba93e9d16",
      "candidate_digest": "0d78abdece256237805792ca6b5339fba53e7018001eaa4a81ba73ae262539f4",
      "environment": {
        "platform": "win32",
        "arch": "x64",
        "os_type": "Windows_NT",
        "os_release": "10.0.19045",
        "hostname": "DESKTOP-8SVSB4R",
        "gate_host_provenance": "unknown"
      },
      "tool_versions": {
        "node": "v24.12.0",
        "pnpm": "10.29.3",
        "python": "Python 3.13.12",
        "docker": "Docker version 29.0.2-rd, build 5a2d7eb",
        "os": "Windows_NT 10.0.19045 (x64)"
      },
      "test_counts": "unknown",
      "observed_effect": "Terminal log marker for exit_code=0: {\"work_packages\":59,\"features\":71,\"profile_gates\":{\"evaluation\":8,\"assisted-sale\":12,\"production-ga\":12,\"investor\":12}} Last non-empty log line: {\"work_packages\":59,\"features\":71,\"profile_gates\":{\"evaluation\":8,\"assisted-sale\":12,\"production-ga\":12,\"investor\":12}}",